{
  "client_name": "Example",
  "client_sw_version": "1.6.2",
  "hardware": {
    "cpu_usage": 15.8,
    "disk_total_GB": 471,
    "disk_used_GB": 435,
    "ram_total_MB": 32495,
    "ram_used_MB": 12216
  },
  "hostname": "TD0262245",
  "json_version": "2.0",
  "local_time": "2024-09-06 21:41:24",
  "net_interfaces": [
    {
      "interface": "Ethernet 8",
      "ip_addresses": [
        "192.168.249.1",
		"192.168.249.2"
      ],
      "mac": "02-00-00-02-12-01"
    },
    {
      "interface": "Ethernet 10",
      "ip_addresses": [
        "141.86.197.114"
      ],
      "mac": "10-E7-C6-44-7A-65"
    },
    {
      "interface": "vEthernet (Default Switch)",
      "ip_addresses": [
        "172.30.128.1"
      ],
      "mac": "00-15-5D-1F-6D-4E"
    }
  ],
  "network_name": "TD0262245.domain.com",
  "os": {
    "os_name": "Windows 10",
    "os_platform": "Windows-10-10.0.19045-SP0",
    "uptime": "1d, 11:10:37"
  },
  "users": [
    {
      "idle_time": "3:48",
      "logged": false,
      "login_time": "05/09/2024 14:12",
      "session_id": "2",
      "session_name": "",
      "status": "Disc",
      "username": "F88899C"
    },
    {
      "idle_time": "5:56",
      "logged": false,
      "login_time": "06/09/2024 15:42",
      "session_id": "3",
      "session_name": "",
      "status": "Disc",
      "username": "C10585B"
    }
  ]
}